{
  "$schema": "http://json-schema.org/draft-07/schema#",
  "$id": "tool-manifest",
  "type": "object",
  "required": ["name", "description", "version", "action_risk"],
  "additionalProperties": false,
  "properties": {
    "name": { "type": "string", "minLength": 1 },
    "description": { "type": "string", "minLength": 1 },
    "version": { "type": "string", "minLength": 1 },
    "action_risk": {
      "oneOf": [
        {
          "type": "string",
          "enum": ["none", "low", "medium", "high", "critical"]
        },
        {
          "type": "integer",
          "minimum": 0,
          "maximum": 100
        }
      ]
    },
    "sensitivity": {
      "type": "string",
      "enum": ["normal", "elevated"]
    },
    "inputs": {
      "type": "object",
      "additionalProperties": { "type": "string" }
    },
    "outputs": {
      "type": "object",
      "additionalProperties": { "type": "string" }
    },
    "permissions": {
      "type": "array",
      "items": { "type": "string" }
    },
    "secrets": {
      "type": "array",
      "items": { "type": "string" }
    },
    "timeout": { "type": "integer", "minimum": 1 },
    "capabilities": {
      "type": "array",
      "items": { "type": "string" }
    },
    "optional_capabilities": {
      "type": "array",
      "items": { "type": "string" },
      "description": "Capabilities injected when the deployment has the service and skipped otherwise; their absence never refuses the call. A name may not also be in capabilities."
    },
    "entity_enrichment": {
      "type": "object",
      "required": ["param", "default"],
      "additionalProperties": false,
      "properties": {
        "param": { "type": "string", "minLength": 1 },
        "default": { "type": "string", "enum": ["caller", "agent"] }
      }
    },
    "allowed_callers": {
      "type": "array",
      "items": { "type": "string", "minLength": 1 },
      "description": "Agent names allowed to invoke this skill. Omit for unrestricted access. 'system' is a reserved name for system-layer invocations."
    },
    "install": {
      "type": "object",
      "additionalProperties": false,
      "properties": {
        "requires_secrets": {
          "type": "array",
          "items": { "type": "string", "minLength": 1 },
          "description": "Vault secret keys this skill needs configured before it can be installed or enabled."
        }
      }
    },
    "uninstall": { "type": "object" },
    "skip_secret_redaction": {
      "type": "boolean",
      "description": "When true, this skill's output bypasses ONLY the broad generic-long-hex secret scrub (the structured credential scrubs — API keys, JWT/Bearer, AWS — stay active). For skills whose output legitimately carries a high-entropy hex capability token that must reach the LLM to be relayed (e.g. secret-capture magic links). Tag-stripping and truncation still apply. Gated at startup: a skill setting this must also declare the 'secretCapture' capability."
    },
    "provenance_source": {
      "type": "boolean",
      "description": "When true, this skill's successful output is source text for identifier provenance (#2061, ADR-047): an address or number in it may be stored as a verified contact identity when an agent enters it. Only for skills whose output is data they read (a web page, a document, a mail listing), never text a model wrote. Default false."
    }
  }
}
