{
  "name": "secret-capture-request",
  "description": "Mint a one-time, single-use, 30-minute link the user can click to enter a personal secret (e.g. a website password). The value is typed into a secure web form and written straight to the vault under a deterministic `user.*` key — repeat captures of the same secret update that key in place instead of minting a new slug. Call list-user-secrets first; if a matching key already exists, pass that exact name as secret_name, and never ask the user to re-enter a secret that is already stored. Capture also canonicalizes descriptions (so 'X.com password' and 'twitter password' resolve to the same key) and reuses a fingerprint-matching key even if the list step is skipped. You never see the value — this skill returns only the link. Relay the returned capture_url to the user verbatim. When the user fills the link, you are automatically brought back into this conversation to continue. Pass login_url/username (not secret) when known; details_only:true saves them on a stored key, no link.",
  "version": "0.4.0",
  "sensitivity": "normal",
  "action_risk": "low",
  "inputs": {
    "secret_name": "string (human description of the secret, e.g. 'twitter password'; canonicalized to user.<slug>. Pass an exact existing user.* key from list-user-secrets to update that key in place)",
    "label": "string? (text shown to the user on the form; defaults to the secret_name)",
    "value_format": "string? ('string' (default) or 'json')",
    "resume_intent": "string? (a short description of what you are trying to do, e.g. 'check the user's Aeroplan balance'; surfaced back to you when the secret is captured so you can continue)",
    "login_url": "string? (sign-in page URL)",
    "username": "string? (sign-in username)",
    "details_only": "boolean?"
  },
  "outputs": {
    "capture_url": "string (the one-time link to send the user)",
    "expires_at": "string (local ISO timestamp when the link expires)",
    "secret_name": "string (the resolved user.<slug> vault key the value will be stored under)",
    "reused_existing": "boolean (true when this capture will update an already-stored user.* key)"
  },
  "permissions": [],
  "secrets": [],
  "timeout": 30000,
  "capabilities": ["secretCapture"],
  "skip_secret_redaction": true
}
