{
  "name": "secret-capture-request",
  "description": "Mint a one-time, single-use, 30-minute link the user can click to enter a NEW personal secret (e.g. a website password). The value is typed by the user into a secure web form and written straight to the vault under a `user.<slug>` key. You never see the value — this skill returns only the link, never the secret. Use when a task needs a secret the vault does not yet have.",
  "version": "0.1.1",
  "sensitivity": "normal",
  "action_risk": "low",
  "inputs": {
    "secret_name": "string (human description of the secret, e.g. 'my flight site password'; auto-namespaced to user.<slug>)",
    "label": "string? (text shown to the user on the form; defaults to the secret_name)",
    "value_format": "string? ('string' (default) or 'json')"
  },
  "outputs": {
    "capture_url": "string (the one-time link to send the user)",
    "expires_at": "string (local ISO timestamp when the link expires)",
    "secret_name": "string (the resolved user.<slug> vault key the value will be stored under)"
  },
  "permissions": [],
  "secrets": [],
  "timeout": 30000,
  "capabilities": ["secretCapture"],
  "skip_secret_redaction": true
}
