{
  "name": "list-spot-checks",
  "description": "Up to three of Curia's recent autonomous actions for the principal to spot-check, as a ready-made numbered block. Put the block in the digest exactly as returned. Returns block null when there is nothing to check.",
  "version": "0.1.0",
  "sensitivity": "normal",
  "action_risk": "none",
  "inputs": {},
  "outputs": {
    "block": "string? (the 'Spot check' block, verbatim)",
    "count": "number"
  },
  "permissions": [],
  "secrets": [],
  "timeout": 15000,
  "capabilities": ["actionLogRepo", "entityMemory"],
  "optional_capabilities": ["outboundGateway"],
  "allowed_callers": ["coordinator"]
}
