{
  "name": "skill-activate",
  "description": "Activate a discovered skill (bundle) for this task: load its member tools into your toolkit and inject its SKILL.md instructions. For imported Anthropic skills, pass optional `reference` to load one text file from references/ or assets/ (e.g. \"common-clauses.md\"); binary assets are listed but cannot be loaded into context. Call after tool-registry returns kind:\"skill\". Activation does not grant new authority — member tools still respect allowed_callers and action_risk, and a skill whose tools are all reserved for other agents is refused: delegate to its owner instead. When running on a bound task, the active set is persisted for wake re-load automatically.",
  "version": "0.2.2",
  "sensitivity": "normal",
  "action_risk": "none",
  "inputs": {
    "skill": "string (skill bundle name from tool-registry, e.g. tasks or not-a-lawyer)",
    "reference": "string? (optional path under references/ or assets/, e.g. common-clauses.md)"
  },
  "outputs": {
    "skill": "string",
    "tools": "array",
    "skippedTools": "array",
    "instructionsLoaded": "boolean",
    "references": "array",
    "assets": "array",
    "referenceContent": "object?"
  },
  "permissions": [],
  "secrets": [],
  "timeout": 5000,
  "capabilities": [
    "skillRegistry"
  ],
  "optional_capabilities": [
    "taskRepo"
  ]
}
